{
  "schemaVersion": "1.0.0",
  "generatedAt": "2026-07-30",
  "scope": "Armor 3.0",
  "seedStatus": {
    "setBonusTableAvailable": true,
    "notes": "All 56 set bonuses now contain verified 2-piece and 4-piece effects with cited sources. Effect text sourced from blueberries.gg (2026-07-08); Flain's 2pc/4pc order cross-checked against light.gg Bungie-API data."
  },
  "components": [
    {
      "id": "set-bonus-aion-adapter",
      "name": "AION Adapter",
      "type": "setBonus",
      "subclass": null,
      "element": null,
      "effect": "Final blows with a Rocket or Grenade Launcher briefly reduce incoming area-of-effect damage.\nWhile Force Absorption is active, taking melee damage makes you emit a one-time disorienting burst.",
      "verified": true,
      "sources": [
        {
          "title": "Destiny 2 Armor Set Bonus: Full List & Effects",
          "publisher": "blueberries.gg",
          "date": "2026-07-08"
        }
      ],
      "setBonus": {
        "twoPiece": {
          "name": "Force Absorption",
          "effect": "Final blows with a Rocket or Grenade Launcher briefly reduce incoming area-of-effect damage.",
          "verified": true
        },
        "fourPiece": {
          "name": "Reactive Shock",
          "effect": "While Force Absorption is active, taking melee damage makes you emit a one-time disorienting burst.",
          "verified": true
        }
      }
    },
    {
      "id": "set-bonus-aion-renewal",
      "name": "AION Renewal",
      "type": "setBonus",
      "subclass": null,
      "element": null,
      "effect": "After a final blow with any Rocket or Grenade Launcher, sprint for a short time to gain Speed Booster.\nOnce per Force Converter activation, sprinting while at critical health, suspended, or slowed by Stasis instantly grants Speed Booster for a short time.",
      "verified": true,
      "sources": [
        {
          "title": "Destiny 2 Armor Set Bonus: Full List & Effects",
          "publisher": "blueberries.gg",
          "date": "2026-07-08"
        }
      ],
      "setBonus": {
        "twoPiece": {
          "name": "Force Converter",
          "effect": "After a final blow with any Rocket or Grenade Launcher, sprint for a short time to gain Speed Booster.",
          "verified": true
        },
        "fourPiece": {
          "name": "Reactive Booster",
          "effect": "Once per Force Converter activation, sprinting while at critical health, suspended, or slowed by Stasis instantly grants Speed Booster for a short time.",
          "verified": true
        }
      }
    },
    {
      "id": "set-bonus-apostate-s-blade",
      "name": "Apostate's Blade",
      "type": "setBonus",
      "subclass": null,
      "element": null,
      "effect": "Performing a finisher stores power; the next time your shields break, it is spent to instantly heal you and trigger health regeneration.\nWhile under the effect of Radiant, Restoration, or Cure, your standard melee hits release a scorching burst of energy.",
      "verified": true,
      "sources": [
        {
          "title": "Destiny 2 Armor Set Bonus: Full List & Effects",
          "publisher": "blueberries.gg",
          "date": "2026-07-08"
        }
      ],
      "setBonus": {
        "twoPiece": {
          "name": "Regenerative Threshold",
          "effect": "Performing a finisher stores power; the next time your shields break, it is spent to instantly heal you and trigger health regeneration.",
          "verified": true
        },
        "fourPiece": {
          "name": "Melee Conduction",
          "effect": "While under the effect of Radiant, Restoration, or Cure, your standard melee hits release a scorching burst of energy.",
          "verified": true
        }
      }
    },
    {
      "id": "set-bonus-atheon-s-memory",
      "name": "Atheon's Memory",
      "type": "setBonus",
      "subclass": null,
      "element": null,
      "effect": "After picking up an Orb of Power, the next time your shields break you gain a temporary bonus to your Health stat and release a burst of radiolaria around you.\nWhile affected by any subclass buff, dealing sustained damage to targets creates an Orb of Power.",
      "verified": true,
      "sources": [
        {
          "title": "Destiny 2 Armor Set Bonus: Full List & Effects",
          "publisher": "blueberries.gg",
          "date": "2026-07-08"
        }
      ],
      "setBonus": {
        "twoPiece": {
          "name": "Radiolaria Breach",
          "effect": "After picking up an Orb of Power, the next time your shields break you gain a temporary bonus to your Health stat and release a burst of radiolaria around you.",
          "verified": true
        },
        "fourPiece": {
          "name": "Collective Power",
          "effect": "While affected by any subclass buff, dealing sustained damage to targets creates an Orb of Power.",
          "verified": true
        }
      }
    },
    {
      "id": "set-bonus-bushido",
      "name": "Bushido",
      "type": "setBonus",
      "subclass": null,
      "element": null,
      "effect": "Final blows with freshly drawn or reloaded weapons heal you.\nBow, Shotgun, or Sword final blows temporarily reduce incoming damage; damaging targets with those weapons extends the effect.",
      "verified": true,
      "sources": [
        {
          "title": "Destiny 2 Armor Set Bonus: Full List & Effects",
          "publisher": "blueberries.gg",
          "date": "2026-07-08"
        }
      ],
      "setBonus": {
        "twoPiece": {
          "name": "Iaido",
          "effect": "Final blows with freshly drawn or reloaded weapons heal you.",
          "verified": true
        },
        "fourPiece": {
          "name": "Unfaltering Focus",
          "effect": "Bow, Shotgun, or Sword final blows temporarily reduce incoming damage; damaging targets with those weapons extends the effect.",
          "verified": true
        }
      }
    },
    {
      "id": "set-bonus-circuit",
      "name": "Circuit",
      "type": "setBonus",
      "subclass": null,
      "element": null,
      "effect": "Sustaining fast movement builds an elemental charge that accelerates health regeneration; once fully revved up, sprinting grants Speed Booster.\nPerforming a slide while Speed Booster is active jolts combatants directly in front of you.",
      "verified": true,
      "sources": [
        {
          "title": "Destiny 2 Armor Set Bonus: Full List & Effects",
          "publisher": "blueberries.gg",
          "date": "2026-07-08"
        }
      ],
      "setBonus": {
        "twoPiece": {
          "name": "Revving Up",
          "effect": "Sustaining fast movement builds an elemental charge that accelerates health regeneration; once fully revved up, sprinting grants Speed Booster.",
          "verified": true
        },
        "fourPiece": {
          "name": "Dielectric Drift",
          "effect": "Performing a slide while Speed Booster is active jolts combatants directly in front of you.",
          "verified": true
        }
      }
    },
    {
      "id": "set-bonus-coda",
      "name": "CODA",
      "type": "setBonus",
      "subclass": null,
      "element": null,
      "effect": "Light-element final blows grant Light Polarity, increasing your Grenade stat; Darkness or Kinetic final blows grant Dark Polarity, increasing your Melee stat.\nLight-weapon final blows grant grenade energy and Dark or Kinetic final blows grant melee energy; rapidly alternating Light and Dark final blows grants a short period of damage resistance.",
      "verified": true,
      "sources": [
        {
          "title": "Destiny 2 Armor Set Bonus: Full List & Effects",
          "publisher": "blueberries.gg",
          "date": "2026-07-08"
        }
      ],
      "setBonus": {
        "twoPiece": {
          "name": "Between Poles",
          "effect": "Light-element final blows grant Light Polarity, increasing your Grenade stat; Darkness or Kinetic final blows grant Dark Polarity, increasing your Melee stat.",
          "verified": true
        },
        "fourPiece": {
          "name": "So Very Thin",
          "effect": "Light-weapon final blows grant grenade energy and Dark or Kinetic final blows grant melee energy; rapidly alternating Light and Dark final blows grants a short period of damage resistance.",
          "verified": true
        }
      }
    },
    {
      "id": "set-bonus-collective-psyche",
      "name": "Collective Psyche",
      "type": "setBonus",
      "subclass": null,
      "element": null,
      "effect": "Picking up an ammo brick gives a stacking bonus to weapon swap and stow speed until you die.\nSuspend, unravel, and sever effects on targets, and radiant and restoration effects on you, have increased duration.",
      "verified": true,
      "sources": [
        {
          "title": "Destiny 2 Armor Set Bonus: Full List & Effects",
          "publisher": "blueberries.gg",
          "date": "2026-07-08"
        }
      ],
      "setBonus": {
        "twoPiece": {
          "name": "Accretion",
          "effect": "Picking up an ammo brick gives a stacking bonus to weapon swap and stow speed until you die.",
          "verified": true
        },
        "fourPiece": {
          "name": "Doppler Effect",
          "effect": "Suspend, unravel, and sever effects on targets, and radiant and restoration effects on you, have increased duration.",
          "verified": true
        }
      }
    },
    {
      "id": "set-bonus-crota-s-memory",
      "name": "Crota's Memory",
      "type": "setBonus",
      "subclass": null,
      "element": null,
      "effect": "Your melee final blows trigger a devastating Cursed Thrall explosion.\nRemaining in active combat for an extended duration grants progressively higher flinch and damage resistance against combatants.",
      "verified": true,
      "sources": [
        {
          "title": "Destiny 2 Armor Set Bonus: Full List & Effects",